{
  "schemaVersion": "1.0.0",
  "taskId": "TASK-PORT-01-RELEASE-BOUNDARY",
  "title": "Define the first production release boundary",
  "phase": 4,
  "status": "complete",
  "owner": "design-system-agent",
  "objective": "Turn the canonical foundations, expression suite, navigation and Golden Homepage into one explicit production-release plan without silently promoting candidate dependencies, exposing unredacted proof media or creating a second source of design truth.",
  "scope": {
    "included": [
      "complete canonical and candidate dependency inventory for Golden Homepage 1.0.0",
      "release inclusion, exclusion and promotion matrix",
      "release-safe operating-proof payload contract",
      "self-contained package manifest and version boundary",
      "clean-consumer installation proof plan",
      "update, rollback and version-visibility plan",
      "named future consumer interface without modifying that consumer"
    ],
    "excluded": [
      "publishing or deploying a production website",
      "modifying the separate technical Mez Systems repository",
      "silently promoting CMP-05 or CMP-06",
      "shipping unredacted operating-proof media",
      "live routes, analytics, payments, authentication or availability",
      "Figma library production",
      "new channel systems"
    ]
  },
  "dependencies": [
    "TASK-GOLD-01-GOLDEN-HOMEPAGE",
    "DEC-GOLDEN-HOMEPAGE-001",
    "DEC-FOUNDATION-RELEASE-001",
    "DEC-GLOBAL-NAVIGATION-COMPONENT-001"
  ],
  "inputs": {
    "requiredFiles": [
      "brand-kit/AGENT-GUIDE.md",
      "brand-kit/START-HERE.md",
      "brand-kit/docs/CURRENT-STATE.md",
      "brand-kit/docs/ROADMAP.md",
      "brand-kit/governance/decisions.json",
      "brand-kit/golden/homepage/homepage.source.json",
      "brand-kit/golden/homepage/review.json",
      "brand-kit/golden/homepage/round-29-approval.json",
      "brand-kit/components/halftone-portrait/halftone-portrait.source.json",
      "brand-kit/components/testimonial-marquee/testimonial-marquee.source.json",
      "brand-kit/releases/0.1.0-alpha.1/release.json",
      "brand-kit/releases/0.1.0-alpha.1/artifact-manifest.json"
    ],
    "decisionIds": [
      "DEC-GOLDEN-HOMEPAGE-001",
      "DEC-FOUNDATION-RELEASE-001",
      "DEC-GLOBAL-NAVIGATION-COMPONENT-001"
    ],
    "artifactIds": [],
    "consumerIds": []
  },
  "deliverables": [
    {
      "path": "brand-kit/releases/production-01-plan/",
      "acceptance": [
        "every dependency is classified as canonical, candidate, generated, evidence-only or consumer-owned",
        "candidate components are either routed to their own human promotion gates or excluded behind a stable interface",
        "no unredacted operating-proof media is release-eligible",
        "the package boundary is self-contained and names clean-install, update, rollback and version-visibility evidence"
      ]
    }
  ],
  "verification": [
    {
      "id": "PORT-01-BOUNDARY",
      "method": "schema",
      "passCondition": "the release plan parses, every dependency has one authority class and every exclusion has an owning follow-up"
    },
    {
      "id": "PORT-01-NO-SILENT-PROMOTION",
      "method": "manual-inspection",
      "passCondition": "CMP-05 and CMP-06 retain candidate status unless separate Olli decisions explicitly promote them"
    },
    {
      "id": "PORT-01-PROOF-SAFETY",
      "method": "manual-inspection",
      "passCondition": "the plan cannot include raw operating-proof media and defines a redacted provenance-preserving payload"
    }
  ],
  "humanGate": {
    "required": false,
    "gateId": null,
    "approver": null,
    "approvalQuestion": null
  },
  "stopConditions": [
    "a candidate component would need production authority without its own recorded human decision",
    "the release would contain unredacted operating-proof media",
    "the task requires changes inside a consumer repository",
    "the package cannot be made self-contained without an undeclared private dependency"
  ],
  "notes": [
    "This task defines the release boundary; it does not assemble or publish the production release.",
    "The first follow-up is TASK-PORT-02-HOMEPAGE-DEPENDENCY-GATES: one batched packet with separate CMP-05 and CMP-06 promotion or exclusion decisions, followed by isolated package assembly and then a named consumer integration.",
    "Completed on 2026-07-28. The release plan records central decision-ledger drift as a production-assembly blocker rather than mutating governance inside PORT-01."
  ]
}
